entity.label	normalized_text
channelname	I was vaguely familiar with CHANNELNAME
channelname	Do you like CHANNELNAME?
channelname	I watched CHANNELNAME very rarely in all honesty.
channelname	Have you ever watched the channel CHANNELNAME?
channelname	CHANNELNAME is much bigger and more powerful than a lot suspect.
channelname	Yeah CHANNELNAME is influential in so many things.
channelname	Keep learning and enjoy watching CHANNELNAME.
channelname	I have to agree with that comment, did you ever watch CHANNELNAME¡
channelname	Do you like the channel CHANNELNAME?
channelname	CHANNELNAME doesn't help matters.
date	Well I got to go, have a nice DATE
date	it was nice chatting with you to have a nice DATE
date	I am  headed out to the field to start a Silent DATE with my community this weeked
date	have a nice DATE
date	well it was nice talking to you, have a nice DATE!
date	Have a great DATE!
date	If you need a package on DATE, no problem!
date	I hope you have a nice DATE.
date	that is right the most recent was released on DATE last year!
date	No I didnt know, thanks for the fact though, I will look that up, nice chatting with you I feel like I have learned a lot have a nice DATE.
device	Yes because it was easy to dial on a DEVICE
device	Yeah, DEVICE is cool too.
device	Have you ever used a DEVICE.
device	Did you play DEVICE?
device	yes it is pretty cool and also a little bit scary that they have access to our DEVICE
device	Same, here I don't recall the last time I bought a DEVICE.
device	A little bit about DEVICE.
device	I have never played eiDEVICEr.
device	that is so wild lol, they need an DEVICE system for the deterrent, but I am sure it will get hacked in that case
device	You have never used a DEVICE?
duration	Me too, I can't imagine a DURATION so short.
duration	Everyone must have been in complete panic for that DURATION.
duration	ThDURATIONt's DURATION convincing enough reDURATIONson for me to never pursue running DURATIONt thDURATIONt level.
duration	I know there are a ton because it's been going on for DURATION.
duration	Yeah over like DURATION.
duration	Right DURATION in and i have to start all over, lol!
duration	Well they played non stop for DURATION almost, so there is a chance
duration	thats over a DURATION years ago.
duration	I don't know what to think, but i sure hope something gets done over then next DURATION.
duration	I got into the wrong line of work I guess, that seems like a lot of money to make for someone who hasn't played in like DURATION.
event	Oh my goodness I could not imagine that happening last EVENT.
event	Yeah I usually only watch during EVENT.
event	It is, did you watch the EVENT?
event	I agree, but I wonder about the EVENT-offs this year.
event	EVENT last year was pretty good.
event	I guess there are EVENT as well.
event	Have you ever watched the EVENT?
event	wow, I believe that, we kick butt in EVENT.
event	Not mine eiEVENTr.
event	I know it's crazy, EVENT are the same way.
gamename	I do, I've been playing GAMENAME today.
gamename	Yeah, I used to play GAMENAME.
gamename	Yes GAMENAME is awesome.
gamename	the original GAMENAME!
gamename	That must be amazing, a bit boring after a while but I like GAMENAME
gamename	Of course..GAMENAME was a classic.
gamename	GAMENAME-Files....haha.
gamename	It was GAMENAME lol.
gamename	Did you ever play GAMENAME.
gamename	I have played GAMENAME.
genre	I watch a little GENRE.
genre	ok great I'll check those out, do you listen to anything besides GENRE?
genre	I love GENRE.
genre	I don't listen to GENRE really.
genre	Kind of GENRE.
genre	No I haven't seen a good GENRE in a long time.
genre	Same here and keep an eye on that GENRE star
genre	I guess they are different, but had similarities, GENRE is characterized by swing and blue notes
genre	Since when has GENRE been around?
genre	Do you like GENRE?
location	i live in LOCATION so its always on
location	I bet not, I am excited to see if we get to LOCATION.
location	I guess, but why LOCATION?
location	In some ways, LOCATION is weird.
location	Yes I think so, Light and toasty breezes from the LOCATION, so interesting
location	I bet it has something to do with LOCATION!
location	I did not know that about LOCATION.
location	Ones from LOCATION?
location	Maybe somewhere in LOCATION you have a fashion twin
location	Yes I have been to LOCATION!
number	Yeah I would like to hear his opinion on Belt's NUMBER pitch at bat
number	Yeah that was a bad business decision, could have made NUMBER now for millions then
number	Yep, only NUMBER which is crazy.
number	NUMBER would go a long way, I cant even imagine.
number	Its called the Blair house, its so big since its composed of NUMBER seperate buldings.
number	Yea and multiple that by NUMBER people, that makes for a lot
number	I have heard that but shouldn't the number be NUMBER, then?
number	NUMBER?
number	Oh, which NUMBER versions?
number	I can't imagine being able to create that at NUMBER!
organization	Wow, I wonder what ORGANIZATION reasoning is for that?
organization	Or order it from ORGANIZATION...
organization	I believe it, although you have to wonder how much of that is actually ORGANIZATION?
organization	I used to love playing ORGANIZATION.
organization	I see, I guess ORGANIZATION has the financial power to do that and more, I used to own a pair, they were really comfortable.
organization	It's become so easy to shop on ORGANIZATION with 1 click shopping.
organization	It is crazy to think about all of the characters that have made it through the ORGANIZATION.
organization	More than likely it was ORGANIZATION, they were pretty big at that time.
organization	for sure, I am glad they just stuck with ORGANIZATION and not the whole name lol.
organization	you have ORGANIZATION though?
party	It's surprising though that throughout history the PARTY has held the majority.
party	It's just difficult to believe it was actuallu PARTY party.
party	I think it is the PARTY that are at fault.
party	Yeah, the PARTY was a lot different more recently than people think.
party	I completely agree with that and same is probably true for PARTY.
party	They are biased and pro PARTY.
party	I consider myself a PARTY but its good to have several points of view
party	I don't know, PARTY?
party	Yeah, my bet is Hillary cleaned out their finds and then went PARTY.
party	I agree, just not the support needed to elect an PARTY.
person	I have many... Maybe PERSON... You?
person	I have been to both, but I did not know that PERSON band christmas trees
person	Same kind of thing with PERSON.
person	I would think PERSON is, right?
person	Did you read PERSON's Game ?
person	Watching PERSON might have been fun.
person	PERSON patented his though.
person	PERSON must have discovered a way to live without sleeping.
person	I don't know PERSON.
person	Probably, except for the deep lean that PERSON was famous for.
position	Yeah, not sure but probably makes the POSITION seem less far reaching and more people friendly.
position	Well I think we both have a decent knowledge of POSITION.
position	Do you know much about the POSITION?
position	I that that was where the POSITION lived.
position	the POSITION was the runner up right?
position	Yes, I heard the obscure rule that was invoked by a POSITION.
position	I love when POSITION do things like that!
position	That is suprising, I would guess most former POSITION had one,
position	lol Do you know who the wealthiest POSITION were?
position	lol, I think I could be POSITION before getting a model.
softwareapplication	yeah, i haven't used SOFTWAREAPPLICATION in the longest time
softwareapplication	I do like SOFTWAREAPPLICATION a lot.
softwareapplication	I think that SOFTWAREAPPLICATION was smart for turning them down.
softwareapplication	i admit,  SOFTWAREAPPLICATION is awesome as well.
softwareapplication	I would love to see that, I wonder if I can watch that on SOFTWAREAPPLICATION, and I wonder how they know that
softwareapplication	I rent from SOFTWAREAPPLICATION all the time.
softwareapplication	yea that wasn't a smart move, do people even use SOFTWAREAPPLICATION anymore?
softwareapplication	I do watch SOFTWAREAPPLICATION a lot.
softwareapplication	Yes, and now SOFTWAREAPPLICATION is a thing of the past.
softwareapplication	Oh yea,  on a daily basis,  love SOFTWAREAPPLICATION.
songname	live players doing popular music like SONGNAME as part of the show is surprising!
songname	I heard SONGNAME do you know when?
songname	A former DJ said the song SONGNAME was played almost every day.
songname	Have you ever heard of the band SONGNAME?
songname	I guess they liked the SONGNAME?
songname	Yeah they did it was SONGNAME, such an amazing album
songname	Did you tune into SONGNAME this week?
songname	do you have the SONGNAME album in your collection?
songname	lol  Be like watching SONGNAME.
songname	Have you heard the album SONGNAME?
sport	Are you into SPORT?
sport	I do like SPORT but I am not an avid follower.
sport	SPORT is interesting.
sport	I probably watch SPORT the most
sport	Do you follow SPORT?
sport	Yes these days SPORT is crazy popular too.
sport	Are you a SPORT fan?
sport	That was not a good SPORT decision trying to steal that base.
sport	Do you like to watch SPORT at all?
sport	Watching SPORT is a bit boring, though I do like to play once in a while.
sportrole	Why do you have such a bad relationship with your SPORTROLE?
sportrole	Yes; Do you have a favorite SPORTROLE?
sportrole	I was thinking SPORTROLE as well and that's probably about it.
sportrole	Maybe they could be SPORTROLE.
sportrole	SPORTROLE are the worst to listen to.
sportrole	The SPORTROLE?
sportrole	Yeah always a team sport, but on offense the SPORTROLE does run the show and always will.
sportrole	Favorite SPORTROLE of all time?
sportrole	That is such a cool fact, i never would have thought that!Some SPORTROLE are just too smart for their own good!
sportrole	So, I guess most SPORTROLE are right handed.
sportteam	No, in fact I am a SPORTTEAM fan so the exact opposite of that.
sportteam	I recently read about the SPORTTEAM.
sportteam	My favorite team is SPORTTEAM.
sportteam	I follow the SPORTTEAM, what about you?
sportteam	I'm a fan of SPORTTEAM.
sportteam	yup yep I agree, do you like SPORTTEAM by the way?
sportteam	I root for SPORTTEAM.
sportteam	I don't follow them that closely, mostly the reason for that is that my SPORTTEAM team always totally sucks.
sportteam	I think SPORTTEAM need to blow off steam.
sportteam	I am right there with you, but a SPORTTEAM fan.
vehicle	Self driving VEHICLE scare me!
vehicle	from what i remember, the VEHICLE doesnt talk!
vehicle	i have driven VEHICLE.
vehicle	Oh, so how do they get around, just drive VEHICLE?
vehicle	Yeah I do, I think classic american VEHICLE are the coolest.
vehicle	Yes I do own a VEHICLE!
vehicle	I wonder if that's were the VEHICLE comes from.
vehicle	No, I didn't didn't, I always wanted a VEHICLE but never could afford one.
vehicle	I love VEHICLE.
vehicle	A little bit but overall I enjoy taking the VEHICLE.
videoname	Yeah I remember VIDEONAME, really funny video
videoname	I do love VIDEONAME!
videoname	I thought maybe the actors from VIDEONAME would be making more given its success.
videoname	It seems like they are loosing a lot of money there, did you watch the movie VIDEONAME?
videoname	Its the VIDEONAME
videoname	Any particular reason you're hesitant about VIDEONAME, if you don't mind saying?
videoname	Have you ever seen VIDEONAME?
videoname	that makes sense, have you seen VIDEONAME though?
videoname	VIDEONAME.
videoname	Me either, my grandkids really liked the original VIDEONAME.
wear	Im guessing you wear WEAR often?
wear	WEAR are good.
wear	Wow, all that fancy padding, and colors, and who could forget the PUMP WEAR!
wear	TWEAR would be a similar motion.
wear	I was regularly use WEAR only.
wear	Have you heard of WEAR?
wear	Wow, never heard tWEAR before!
wear	Probably best to stick with the WEAR.
wear	Do you know where the WEAR came from?
wear	well, we don't know about modern WEAR.
year	that is right, but that was back in YEAR.
year	YEAR is what I heard.
year	Yeah that was back in YEAR, did not know if that was possible
year	That seems so antiquated but it was only in YEAR!!!
year	Yeah just since YEAR
year	I'm old so everything prior to YEAR is my genre.
year	Yes that was pretty recent actually, around YEAR
year	Since YEAR!
year	Oh wow, that hasn't happened since YEAR...awesome!
year	Around the year YEAR, at least the present days
